index,UID,l4,l3_UID
PS-03-04-24,Jkxnud4,Understand the indications for radiation therapy and interventional radiology for major tumors (Table [Tumors]).,JnIAsvE
PS-03-04-25,JkxnuY8,"Understand the indications for pharmacotherapy (cytotoxic anticancer agents, molecular targeted therapies), hematopoietic stem cell transplantation, and cancer immunology for major tumors (Table [Oncology]).",JnIAsvE
PS-03-04-26,JkxnuZA,Understand supportive and palliative care for patients with cancer.,JnIAsvE
PS-03-04-27,JkxnuZE,Understand the social and emotional challenges faced by patients with neoplastic disease.,JnIAsvE
PS-03-05-01,Jkxnuaw,"Understands an overview of the local emergency medical care system using the concepts of pre-hospital emergency care system, medical control, and initial, secondary, and tertiary emergency care.",JnIAsvM
PS-03-05-02,JkxnubY,"Understand the classification of shock causes: (1) abnormal blood flow distribution shock (anaphylactic, septic, neurogenic), (2) hypovolemic shock (hemorrhagic, fluid loss), (3) cardiogenic shock (myocardial contractility, valve disease, arrhythmia), (4) obstructive shock (cardiac tamponade, pulmonary embolism, tension pneumothorax) and their respective Understand the pathogenesis and key points of diagnosis (Table [Emergency system (including diseases caused by poisoning and environmental factors)]).",JnIAsvM
PS-03-05-03,Jkxnubc,Understand the initial response of patients with shock and treatment according to the cause.,JnIAsvM
PS-03-05-04,Jkxnubg,"Understands the classification of causes of cardiac arrest as follows: 1) cardiovascular (acute myocardial infarction, acute aortic dissection, ruptured aortic aneurysm, pulmonary embolism), 2) respiratory (airway obstruction, tension pneumothorax, hypoxemia due to parenchymal lung lesions), 3) neurogenic (severe head and spinal trauma, acute subarachnoid hemorrhage), 4) poisoning and environmental factors (poisoning, heat stroke, hypothermia), 5) electrolyte Understand the pathophysiology and key points of diagnosis of electrolyte and acid-base imbalance (hypo- and hyperkalemia, acidosis, hypoglycemia) (Table [Emergency system (including diseases due to poisoning and environmental factors)]).",JnIAsvM
PS-03-05-05,Jkxnubk,Understand the initial response (primary and secondary life support) and treatment according to the cause in patients with cardiac arrest (Table [Emergency system (including poisoning and diseases due to environmental factors)]).,JnIAsvM
PS-03-05-06,Jkxnubo,To be able to estimate the substance responsible for poisoning from the history and physical examination based on the toxidrome presented by the poisoned patient (Table [Emergency system (including diseases due to poisoning and environmental factors)]).,JnIAsvM
PS-03-05-07,Jkxnubs,"Understand the indications and contraindications for the use of absorption inhibitors, elimination accelerators, and antagonists in the treatment of poisoned patients (Table [Emergency Medicine (including Poisoning and Environmental Factors)]).",JnIAsvM
PS-03-05-08,Jkxnubw,"Understand the etiology (pathogenesis), symptoms, diagnosis and treatment of food poisoning, gas poisoning (carbon monoxide poisoning, hydrogen sulfide, cyanide), pesticide (organophosphorus, organochlorine), alcohol and drug (sleeping pills, psychotropic drugs, antipyretic analgesics, narcotics, stimulants) poisoning (Table [Emergency systems (including poisoning and environmental factors) ]).",JnIAsvM
PS-03-05-09,Jkxnub0,"Understand mercury, lead, cyanide, arsenic, paraquat, natural poisons, poisoning by corrosives (acids, alkalis, hydrogen fluoride), and poisoning by accidental ingestion of button batteries (Table [First Aid (including Poisoning and Environmental Factors)]).",JnIAsvM
PS-03-05-10,Jkxnub4,"Understand the symptoms, main tests/diagnosis, and treatment of disorders caused by high temperatures (heat stroke) and low temperatures (hypothermia) (Table [First Aid (including Poisoning and Environmental Factors)]).",JnIAsvM
PS-03-05-11,Jkxnub8,"Understands the symptoms, main examination/diagnosis, and treatment of disorders caused by air pressure, vibration, and noise (Table [emergency systems (including diseases caused by poisoning and environmental factors)]).",JnIAsvM
PS-03-05-12,Jkxir3g,Understand the pathophysiology and diagnostic essentials of trauma (Table [Emergency Systems (including Poisoning and Diseases Caused by Environmental Factors)]).,JnIAsvM
PS-03-05-13,JkxnucA,"Understands how to assess the severity of burns (presence/absence of airway burns, burn area and depth) and the treatment strategy (Table [emergency systems (including poisoning and environmentally related diseases)]).",JnIAsvM
PS-03-05-14,JkxnuOU,"Understands organ failure (multiple organ failure, cytokine storm, disseminated intravascular coagulation syndrome).",JnIAsvM
PS-03-05-15,JtPHWts,,JnIAsvM
PS-03-05-16,JtPHWt0,,JnIAsvM
PS-03-05-17,JtPHWt4,,JnIAsvM
PS-03-05-18,JtPHWuA,,JnIAsvM
PS-03-05-19,JtPHWuE,,JnIAsvM
PS-03-06-01,JkxnucE,"Understand the types of radiation and radioactivity, and an overview of their properties, quantification methods, and units.",JnIAsvU
PS-03-06-02,JkxnucI,"Understand the outline of internal and external radiation exposure, dosimetry, its pathophysiology, symptoms, diagnosis and treatment.",JnIAsvU
PS-03-06-03,JkxnucM,Understand the effects of radiation and electromagnetic waves on the human body (including the fetus) (acute and late effects) and their appropriate use.,JnIAsvU
PS-03-06-04,JkxnucQ,Understand the differences in radiation permeability and radiosensitivity of various normal tissues.,JnIAsvU
PS-03-06-05,JkxnucU,Understand the characteristics of magnetic fields and electromagnetic waves used in magnetic resonance imaging and understand phenomena such as heat generation in the human body and implanted devices.,JnIAsvU
PS-03-06-06,Jkxnucc,"Understand the three principles of radiation exposure reduction, including medical and occupational exposure, and safety management, and be able to implement exposure reduction in imaging examinations that use radiation (radiography, CT, angiography interventional radiology, fluoroscopy, etc.).",JnIAsvU
PS-03-06-07,Jkxnuck,"Know the benefits, costs, and risks (e.g., radiation dose, acute and late effects) of diagnostic radiology (radiography, computed tomography, nuclear medicine), angiography, and interventional radiology and determine whether they are indicated.",JnIAsvU
PS-03-06-08,Jkxnuco,Understand the biological principles of radiotherapy and an overview of the effects of radiation on genes and cells and the mechanisms of radiation-induced cell death and local and systemic effects.,JnIAsvU
IT-01-01-01,Jkxiflk,Understand the importance and social significance of utilizing information/science technology in medicine.,JnIBpxU
IT-01-01-02,Jkxiflo,"Understand the outline of regulations (laws, guidelines, etc.) related to information, science and technology in medicine.",JnIBpxU
IT-01-01-03,Jkxifls,"Be able to discuss ethical issues that may arise in the utilization of information/science technology in medicine, such as medical disparities caused by the digital divide.",JnIBpxU
IT-01-02-01,Jkxiflw,"Understand the principles of management and storage of medical information, including electronic medical records, and be able to comply with relevant regulations (laws, ethical standards, provisions for the protection of personal information, etc.).",JnIBpxY
IT-01-02-02,Jkxifl0,"Understand and practice appropriate information dissemination as a medical professional when using social media (Internet, SNS, etc.).",JnIBpxY
IT-02-01-01,Jkxifl4,"Use information terminals (computers, smartphones, etc.) to utilize the Internet, applications, etc. in the practice of medicine.",JnIBpxc
IT-02-01-02,Jkxifl8,"Solve problems based on information and data collected using information, science and technology.",JnIBpxc
IT-02-02-01,JkxifmA,"Understand information/science technologies related to medical care (medical information systems, wearable devices, apps, artificial intelligence, telemedicine technology, IoT, etc.) and discuss their potential applications.",JnIBpxg
IT-02-02-02,Jkzptx8,"Understand the role required of medical professionals when applying technology to healthcare, together with experts in information/scientific technology.",JnIBpxg
IT-03-01-01,JkxifmI,Can describe and utilize electronic medical records appropriately based on their characteristics.,JnIBpxk
IT-03-01-02,JkxifmM,"Understands the nature of remote communication and can select and use appropriate tools (e-mail, video conferencing systems, SNS, etc.) according to the purpose.",JnIBpxk
IT-03-02-01,JkxifmQ,"To be able to utilize appropriate ICT (e-learning, mobile technology, etc.) for self-learning and cooperative learning.",JnIBpxs
IT-03-02-02,JkzptyA,Have the flexibility to utilize emerging information and scientific technologies for their own learning and medical care.,JnIBpxs
CS-01-01-01,Jkxirsc,Utilize basic communication skills in medical interviews,JnICVTo
CS-01-01-02,Jkxirsg,"Gather the patient's medical history (chief complaint, history of present illness, medications, allergies, past medical history, family history, preferences, lifestyle, social and occupational history, life environment, home situation, travel history, and systematic reviews), and organize information.",JnICVTo
CS-01-01-03,Jkxirso,Obtain necessary information from people related to the patient.,JnICVTo
CS-01-02-01,Jkxirss,Perform a medical examination according to the patient's condition.,JnICVTs
CS-01-02-02,Jkxirs8,"Assess general appearance (body shape, nutrition, posture, gait, facial features, skin, and speech).",JnICVTs
CS-01-02-03,Jkxirs0,"Check vital signs (temperature, pulse, blood pressure, respiratory rate, and oxygen saturation).",JnICVTs
CS-01-02-04,Jkxirs4,"Examine patients in appropriate positions (standing, sitting, Fowler’s, supine, and lithotriptic).",JnICVTs
CS-01-02-05,Jm6NdFA,Perform a physical examination (Table [Physical Examination]).,JnICVTs
CS-01-02-06,Jkxiru4,Perform necessary basic medical examination.,JnICVTs
CS-02-01-01,Jkxiru8,Gather appropriate patient information and document a problem-oriented medical record.,JnICVT0
CS-02-01-02,JkxirvA,"Document the clinical course in terms of subjective findings, objective findings, assessment, and planning.",JnICVT0
CS-02-01-03,JkxirvE,Summarize the past medical history in the medical record.,JnICVT0
CS-02-02-01,JkxirvI,Understand the causes and pathophysiology of major symptoms (Table [Major Symptoms]).,JnICVT8
CS-02-02-02,JkxirvM,Discuss differential diagnosis of major symptoms (Table [Major Symptoms]) and explain the points of diagnosis.,JnICVT8
CS-02-02-03,Jkxirvg,Demonstrate clinical reasoning from the key chief complaint.,JnICVT8
CS-02-02-04,Jkxirvk,Understand the basic pathophysiology and epidemiology of diseases.,JnICVT8
CS-02-03-01,JkxirwI,"Understand the purpose and significance of major laboratory and imaging tests (Table [Major Laboratory and Imaging Tests]), select the minimum number of tests required to verify the diagnostic hypothesis, and interpret the results.",JnICVUA
CS-02-03-02,JkxirwM,Understand the correct method of specimen collection and storage for major laboratory and imaging tests (Table [Major Laboratory and Imaging Tests]).,JnICVUA
CS-02-03-03,JkxirwQ,"Understand how to perform major laboratory and imaging tests (Table [Major Laboratory and Imaging Tests]) safely (patient and specimen verification, test complications, infection prevention, and accuracy control).",JnICVUA
CS-02-03-04,JkxirxE,"Understand the characteristics (sensitivity, specificity, false positives, false negatives, pretest and posttest probability, likelihood ratio, ROC curve) and criteria (reference value, reference range, cutoff value, panic value) of major laboratory and imaging tests (Table [Major Laboratory and Imaging Tests]).",JnICVUA
CS-02-03-05,JkxirxI,"Understand physiologic variability, measurement error, accuracy control, and human error in major Laboratory and imaging tests (Table [Major laboratory and Imaging Tests]).",JnICVUA
CS-02-03-06,JkxirxM,Understand patient-specific clinical characteristics and interpret results.,JnICVUA
CS-02-03-07,Jm6NdFI,Understand and interpret the purpose and indications for major laboratory and imaging tests (Table [Major Laboratory and Imaging Tests]).,JnICVUA
CS-02-04-01,Jkxirx0,Plan initial response to major syndromes (Table [Major Symptoms]) and determine the need for specialized practice.,JnICVUI
CS-02-04-02,Jkxiry4,Understand the basics of taking medication and adherence.,JnICVUI
CS-02-04-03,Jmicn1A,Draft prescriptions.,JnICVUI
CS-02-04-04,JkxiryY,"Understand the pharmacological effects of medications, indications,adverse events, and precauions of administratinf medictions.",JnICVUI
CS-02-04-05,Jkxiryw,Understand the important point of drug administration with regard to pharmacokinetic characteristics based on age and organ failure.,JnICVUI
CS-02-04-06,Jkxiry0,Understand pharmacokinetic interactions.,JnICVUI
CS-02-04-07,JkxirzE,"Understand contraindications to use and the use of drugs under specific conditions (e.g., anti-doping).",JnICVUI
CS-02-04-08,JkxiryU,"Understand the major drug allergy syndromes, diagnosis, prophylaxis and management.",JnICVUI
CS-02-04-09,JkxiryQ,"Understand drug accumulation, tolerance, tachyphylaxis, and dependence.",JnICVUI
CS-02-04-10,Jkxiryg,"Understand the indications, adverse events, and precautions for administration of antitumor drugs.",JnICVUI
CS-02-04-11,Jkxiryc,"Understand the pharmacologic actions, indications, adverse events, and dosing precautions for antimicrobial agents.",JnICVUI
CS-02-04-12,Jkxiryo,"Understand the indications, adverse events, and administration precautions for narcotic analgesics and sedatives.",JnICVUI
CS-02-04-13,Jkxiry8,Understand the pharmacological actions and adverse events of molecular targeted drugs and biopharmaceuticals.,JnICVUI
CS-02-04-14,JkxirzA,"Understand the characteristics of Kampo medicine, indications of major Japanese and Chinese herbal medicines (Kampo medicine), and their pharmacological actions.",JnICVUI
CS-02-04-15,Jkxirx8,Understand the outline of indications for radiotherapy.,JnICVUI
CS-02-04-16,JkxiryE,Understand the overview of interventional radiology.,JnICVUI
CS-02-04-17,JkxiryI,Understand the indications for treatments using endoscopy.,JnICVUI
CS-02-04-18,JkxiryM,Understand the indications for treatments using ultrasound.,JnICVUI
CS-02-04-19,JkxirzU,"Understand the types, indications, and effects of medical coatings.",JnICVUI
CS-02-04-20,JkxirzY,Understand the indications and complications of surgical procedures,JnICVUI
CS-02-04-21,Jkxirzc,Understand the risk factors of surgery and basic principles of risk management.,JnICVUI
CS-02-04-22,Jkxirzg,Understand the major postoperative complications and the basic principles of prevention.,JnICVUI
CS-02-04-23,Jkxirzk,Understand the importance of informed consent for surgery and invasive procedures.,JnICVUI
CS-02-04-24,Jkxirzo,Understand the perioperative risk assessment.,JnICVUI
CS-02-04-25,Jkxirzs,Understand the perioperative medication management and risk.,JnICVUI
CS-02-04-26,Jkxirzw,Understand the perioperative fluid and blood transfusions.,JnICVUI
CS-02-04-27,Jkxirz0,Understand the perioperative pain management.,JnICVUI
CS-02-04-28,Jkxir0Q,"Understand the indications, contraindications and complications of local anesthesia, peripheral nerve block, plexus block, spinal anesthesia and epidural anesthesia.",JnICVUI
CS-02-04-29,Jkxir0E,Understand the preanesthesia evaluation for safe management.,JnICVUI
CS-02-04-30,Jkxir0U,"Understand the patient monitoring during anesthesia, and major abnormal findings and management measures of them.",JnICVUI
CS-02-04-31,Jkxir0I,Understand the types of anesthetics and muscle relaxants and the principles of their use.,JnICVUI
CS-02-04-32,Jkxir0M,"Understand the indications, contraindications, methods, accidents and complications of inhalation and intravenous anesthesia.",JnICVUI
CS-02-04-33,JtPHhOM,"Understand the airway management techniques, including tracheal intubation.",JnICVUI
CS-02-04-34,Jkxir0g,"Understand the nutritional assessment, care, management, nutrition support team, and disease-specific nutrition supports.",JnICVUI
CS-02-04-35,Jkxir0o,"Understand the indications, methods and complications of parenteral and enteral nutrition, and precautions for long-term administration.",JnICVUI
CS-02-04-36,Jkxir0w,Understand the types and principles of major medical devices.,JnICVUI
CS-02-04-37,Jkxir00,Understand the types and principles of major artificial organs.,JnICVUI
CS-02-04-38,Jkxir04,Understand the types and indications of blood products and fractionated plasma products.,JnICVUI
CS-02-04-39,Jkxir1A,"Understand adverse reactions to blood transfusions, transfusion record keeping requirements, and procedures to prevent incompatible blood transfusions.",JnICVUI
CS-02-04-40,Jkxir1E,"Understand appropriate use of blood transfusion, component transfusion, autologous transfusion, and emergency transfusion.",JnICVUI
CS-02-04-41,Jkxir1I,"Understand the overview of transplantation medicine (organ transplantation, tissue transplantation, hematopoietic stem cell transplantation, etc.) in Japan and the world.",JnICVUI
CS-02-04-42,Jkxir1M,Understand the principles of discussin the organ and tissue donation options in end-of-life care.,JnICVUI
CS-02-04-43,Jkxir1Q,"Understand immune response in transplantation (rejection, graft-versus-host disease).",JnICVUI
CS-02-04-44,Jkxir1U,Understand the overview of immunosuppressive therapy after transplantation.,JnICVUI
CS-02-04-45,Jkxir1Y,Understand the concept and indications for rehabilitation.,JnICVUI
CS-02-04-46,Jkxir1g,Assess functional disability and activities of daily living.,JnICVUI
CS-02-04-47,Jkxir1k,"Understand the overview of physiotherapy, occupational therapy, and speech-language pathology.",JnICVUI
CS-02-04-48,Jkxir1o,"Understand the major walking aids, wheelchairs, prostheses (artificial limbs and feet), and orthotics.",JnICVUI
CS-02-04-49,Jkxir20,Develop a basic treatment plan for basic medical conditions (Table [Basic Medical Conditions]).,JnICVUI
CS-02-05-01,Jkxir28,Formulate plans for patient education in major diseases.,JnICVUM
CS-03-01-01,Jkxir3E,Perform basic clinical procedures related to investigation (Table [Basic Clinical Procedures]).,JnICVUU
CS-03-02-01,Jkxir3I,Perform basic clinical procedures related to treatment (Table [Basic Clinical Procedures]).,JnICVUY
CS-03-03-01,Jkxir3Q,Recognize critically ill based on vital signs and physical signs.,JnICVUg
CS-03-03-02,Jkxir3U,Perform basic life support.,JnICVUg
CS-03-03-03,Jkxir3Y,Assist in performing initial response (including advanced life support) for common and critical conditions.,JnICVUg
CS-03-03-04,Jkxir3k,Assist in the initial response to trauma.,JnICVUg
CS-03-03-05,Jkxirvw,Assist in the response to anaphylactic shock.,JnICVUg
CS-03-04-01,Jkxir3o,Draft various types of medical certificates and patient referral documents,JnICVUk
CS-03-04-02,Jkxir3s,Draft various certificates of post-mortem,JnICVUk
CS-03-05-01,Jkxir4Q,Understands how to consult with other departments.,JnICVUo
CS-03-05-02,Jkxir40,"Understands prevention, evaluation, treatment and cure of bedsores.",JnICVUo
CS-03-06-01,Jkxir48,Present appropriately at case review meetings.,JnICVUs
CS-03-06-02,Jkxir5E,appropriately report information obtained from medical examinations to senior physicians.,JnICVUs
CS-04-01-01,Jkxir5I,Participate in M&M conferences and expresses his/her own opinion.,JnICVU0
CS-04-01-02,Jkxir5M,Participate in CPC and express his/her own opinions.,JnICVU0
CS-05-01-01,JkxoFEA,"Understand the importance of improving medical care using quality improvement methods, and acquire the attitude of repeated evaluation.",JnICVU4
CS-05-02-01,JkxoFEE,"practice the health management (improvement of lifestyle habits, vaccination, measures to reduce radiation exposure) and occupational infection control (tuberculosis examination, vaccination) necessary for healthcare workers.",JnICVVA
CS-05-02-02,JkxoFEM,"Understand the need to improve the working environment of healthcare workers, including themselves, and make efforts to improve it in actual healthcare settings.",JnICVVA
CS-05-03-01,JkxoFD4,"Understand the management system for patient safety and the roles of each (risk manager, medical safety management committee, etc.).",JnICVVE
CS-05-03-02,JlBpVX0,Understand criminal and civil liability related to medical errors and administrative penalties under the Medical Practitioners Act.,JnICVVE
CS-05-04-01,JkxoFD8,"Understand and participate in the roles and significance of systems related to healthcare-associated infections (hospital infection control committee, nosocomial infection surveillance, infection control team, infection control manual, etc.).",JnICVVM
CS-05-04-02,JkxoFEI,Explain the need for and practice standard precautions (standard precautions).,JnICVVM
CS-05-04-03,JlBpVX4,Respond appropriately when encountering a needlestick accident or exposure to bodily fluids.,JnICVVM
CS-05-05-01,JlBpVX8,"Practice basic precautions (patient identification, double-checking, checklist method, alerting to drugs with similar names, fail-safe/fail-proof concept, etc.).",JnICVVQ
CS-05-05-02,JkxoFD0,"Share information on medical safety (adverse drug reactions, drug-related accidents, medical errors, what not to do, good practices, etc.) and analyze the information for post-procedural use.",JnICVVQ
CS-05-06-01,JkxoFDo,Understand and act on the importance of patient safety management for individuals and organizations.,JnICVVY
CS-05-06-02,JkxoFDs,"Understand the importance of medical records, and properly record and handle them.",JnICVVY
CS-05-06-03,JlBpRvs,Respond to inquiries with sincerity.,JnICVVY
CS-05-06-04,JlBpRvw,"Respond to, record, and report medical accidents (including incidents) when they occur.",JnICVVY
CM-01-01-01,Jli9Pdc,Demonstrate verbal communication skills to build good relationships.,JnICfjk
CM-01-01-02,Jli9Pdk,"Be aware of nonverbal communication (grooming, eye contact, facial expressions, gestures, etc.).",JnICfjk
CM-01-01-03,JkxhhVw,Treat patients and family members with respectful wording and attitude.,JnICfjk
CM-01-01-04,JkxhhVs,"Communicate with awareness of psychological factors (positive and negative emotions, etc.) related to interpersonal relationships.",JnICfjk
CM-01-01-05,JkxhhVo,Listen to the patients and their families and state facts and your opinion in a way that they can understand.,JnICfjk
CM-01-02-01,JkxhhV4,"Give sufficient consideration to the mental, physical, and social distress of patients and their families.",JnICfjs
CM-01-02-02,JkxhhWA,"Listen to patients and their families, understand their feelings such as anger, sadness, and anxiety, and empathize with them.",JnICfjs
CM-02-01-01,JkxhhWI,"Communicate with consideration for the diversity of patients and families (elderly, children, disabled, LGBTQ, nationality, race, cultural, linguistic, and customary differences, etc.).",JnICfjw
CM-02-01-02,JkxhhWM,"Explain in simple terms, using as little jargon as possible so that patients can understand.",JnICfjw
CM-02-02-01,JkxhhWQ,"Share information and perspectives with patients and their families, and support decision-making based on understanding and consent.",JnICfj4
CM-02-03-01,JmiwFHw,Understand issues that hinder patients' self-decision-making.,JnICfj8
CM-02-03-02,JmiwFH8,Respect the patient's experience and listen to them so that they can clarify their perspectives.,JnICfj8
CM-02-03-03,JmiwFIA,"Explain the best evidence in an easy-to-understand manner, using as little jargon as possible to support patient decision-making.",JnICfj8
CM-02-03-04,JmiwFII,Plan a treatment plan based on goals consistent with the patient's values.,JnICfj8
CM-03-01-01,JmiwmlM,Assess the patient's psychological and social background and needs for independent living.,JnICfkE
CM-03-01-02,JmiwmlQ,Identify and organize issues and problems that the patient may have.,JnICfkE
CM-03-01-03,JmiwmlU,"Gather necessary information from the patient's proxy, guardian, etc. when no information can be obtained from the patient himself/herself.",JnICfkE
CM-03-02-01,JmiwtUk,Communicate with the patient from the viewpoint of family and community.,JnICfkI
CM-03-02-02,JmiwtUo,Participate in medical treatment that takes into account psychological and social backgrounds.,JnICfkI
CM-03-02-03,JkxhhXA,Understand the uncertainty in medicine and take appropriate actions and attitudes.,JnICfkI
IP-01-01-01,Jkxp2HY,,JnIB3j0
IP-01-02-01,Jkxp2Hg,,JnIB3kA
IP-01-03-01,Jkxp2Ho,,JnIB3kE
IP-01-03-02,Jkxp2Hw,,JnIB3kE
IP-02-01-01,Jkxp2H0,,JnIB3kM
IP-02-01-02,Jkxp2H4,,JnIB3kM
IP-02-02-01,Jkxp2IE,,JnIB3kQ
IP-02-02-02,Jkxp2Is,,JnIB3kQ
IP-02-03-01,Jkxp2IQ,,JnIB3kY
IP-02-03-02,Jk314Eo,,JnIB3kY
IP-02-04-01,Jkxp2IY,,JnIB3kc
SO-01-01-01,JkxoNsc,Understand the concept of public health.,JnH_3oE
SO-01-01-02,JlwC0qE,Understands the concept of community symbiosis.,JnH_3oE
SO-01-01-03,JkxoNsg,Understands the stages of prevention and their strategies.,JnH_3oE
SO-01-01-04,JkxoNsk,"Understands the significance of public health activities (health checkups, health promotion events, etc.) and can play a part in their roles.",JnH_3oE
SO-01-02-01,JkxoNso,"Understands the significance and overview of basic human rights related to health, such as the right to survival, and social security (social insurance, social welfare, and public assistance).",JnH_3oM
SO-01-02-02,JkxoNsw,"Understand the structure and problems of social insurance, including medical insurance, long-term care insurance, and pension insurance as universal health insurance, and be able to discuss measures for improvement.",JnH_3oM
