index,UID,l4,l3_UID
SO-01-02-03,JkxoNs0,"Understand the outline of welfare for persons with disabilities, including the Act on Comprehensive Support for Persons with Disabilities (the Act on Comprehensive Support for Persons with Disabilities) to comprehensively support the daily life and social life of persons with disabilities.",JnH_3oM
SO-01-03-01,JkxoNs4,"Understand the roles of public health centers, municipal health centers, and regional health institutes.",JnH_3oU
SO-01-03-02,JkxoNs8,"Understand the significance and outline of health promotion measures such as the Health Promotion Law, nutrition, physical activity, and rest.",JnH_3oU
SO-01-03-03,JkxoNtA,Understands the basic systems and laws related to community health.,JnH_3oU
SO-01-03-04,JtPHo-Q,,JnH_3oU
SO-01-03-05,JtPHo-Y,,JnH_3oU
SO-01-03-06,JtPHo-c,,JnH_3oU
SO-01-04-01,JkxoNtY,"Understands the basic concepts of industrial health, including the significance of industrial health and 3 management of occupational health.",JnH_3oY
SO-01-04-02,JkxoNtc,Understand the basic systems and laws related to occupational and environmental health.,JnH_3oY
SO-01-04-03,JkxoNtg,Understand occupational accidents and occupational diseases and their countermeasures.,JnH_3oY
SO-01-04-04,JkxoNtk,Understand industrial poisoning caused by hazardous substances and its countermeasures,JnH_3oY
SO-01-05-01,JkxoNtw,Understand the concept and types of health crises and how to respond to them (including risk communication).,JnH_3og
SO-01-05-02,JkxoNt4,"Understand basic systems and laws related to health crisis management (contingencies such as infectious diseases, radiation accidents, and disasters).",JnH_3og
SO-01-05-03,JkxoNuE,"Understand the significance of disaster health care, including disaster base hospitals and various activity teams.",JnH_3og
SO-02-01-01,JkxoNuM,"Understand major demographic statistics (static and dynamic population) and classification and statistics of diseases and disabilities (ICD, etc.).",JnH_3ok
SO-02-01-02,JkxoNuQ,Explain life expectancy and healthy life expectancy.,JnH_3ok
SO-02-02-01,JkxoNuY,Understand the role of epidemiology from a public health and clinical perspective.,JnH_3os
SO-02-02-02,JkxoNuc,"Understand the difference between proportions, ratios, and rates and typical epidemiological indicators (e.g., prevalence rates, risk ratios, morbidity rates).",JnH_3os
SO-02-02-03,JkxoNug,Can give examples of major biases and confounding.,JnH_3os
SO-02-02-04,JkxoNuk,Can explain the difference between direct and indirect methods in age-adjustment.,JnH_3os
SO-02-02-05,JkxoNuo,"Understand the main epidemiology study designs: observational (descriptive, cross-sectional, case-control, cohort) and interventional (randomized controlled trials, etc.).",JnH_3os
SO-02-02-06,JkxoNus,Understand epidemiologic approaches specific to acute infectious diseases.,JnH_3os
SO-02-02-07,JkxoNuw,Able to support decisions that affect populations while taking into account the limitations of the evidence.,JnH_3os
SO-02-03-01,JkxoNu0,"Can describe scales (interval, ratio, ordinal, nominal).",JnH_3ow
SO-02-03-02,JkxoNu4,Can explain the distribution of data (including missing values).,JnH_3ow
SO-02-03-03,JkxoNu8,Explain confidence intervals for the population mean of a normal distribution.,JnH_3ow
SO-02-03-04,JkxoNvA,"Perform correlation analysis, mean and proportion tests, etc.",JnH_3ow
SO-02-03-05,JkxoNvE,Understand the significance of multivariate analysis.,JnH_3ow
SO-03-01-01,JkxoNvI,"Understand vegetative state, brain death, cardiac death, and determination of brain death.",JnH_3o4
SO-03-01-02,JkxoNvM,Understand the handling of unusual deaths and coroner's inquests.,JnH_3o4
SO-03-01-03,JkxoNvQ,To be able to prepare death certificates and medical examiner's reports.,JnH_3o4
SO-03-01-04,JkxoNvU,Understand how to identify individuals.,JnH_3o4
SO-03-01-05,JkxoNvY,"Understand pathological autopsy and forensic autopsy (judicial autopsy, administrative autopsy, cause of death/identification method autopsy, and consent autopsy).",JnH_3o4
SO-04-01-01,JkxoNvk,Be able to work to extend healthy life expectancy.,JnH_3o8
SO-04-01-02,JkxoNvo,"Can act with an understanding of concepts related to disability and the social environment, such as barrier-free access.",JnH_3o8
SO-04-02-01,JkxoNvs,"Can take positive action to eliminate gender inequality, such as discrimination against women and LGBTQ.",JnH_3pE
SO-04-03-01,JkxoNvw,Understand the relationship between climate change and healthcare and can imagine the relationship between climate change and health challenges faced by patients.,JnH_3pM
SO-04-03-02,JkxoNv0,Understand the role of physicians needed in the event of natural disasters (including emerging infectious diseases).,JnH_3pM
SO-04-04-01,JkxoNv8,Understand an overview of the vocabulary of contemporary thought and philosophy.,JnH_3pQ
SO-04-05-01,JmiaT00,Can relativize contemporary medical issues in light of the historical evolution of medicine and medical care.,JnH_3pY
SO-04-06-01,JmiaT1A,Understand the impact of economics on medicine.,JnH_3pc
SO-04-07-01,JtPHxa8,,JtPHwC4
SO-05-01-01,JkxoNwM,Understands the professional rights and duties of physicians as defined by the Medical Practitioners Act.,JnH_3pk
SO-05-01-02,JkxoNwQ,Be able to explain the laws and systems governing the medical profession.,JnH_3pk
SO-05-01-03,JkxoNwU,Understand the types and functions of medical facilities as defined by the Medical Care Act.,JnH_3pk
SO-05-01-04,JkxoNwY,Understand the outline of medical care planning.,JnH_3pk
SO-05-01-05,Jk31tVk,Understand the interconnectedness of issues related to regional medical care delivery systems.,JnH_3pk
SO-05-01-06,Jk31tVo,To be able to express one's own ideas about the medical care delivery system and the way doctors work.,JnH_3pk
SO-05-02-01,JkxoNwc,"Understand the overview of medical and health issues that need to be addressed internationally, based on historical and social backgrounds.",JnH_3po
SO-05-02-02,JkxoNwo,Understand the significance of universal health coverage and be able to give examples of problems faced by health care systems around the world.,JnH_3po
SO-05-02-03,JkxoNws,Understand an overview of health-related United Nations development goals and organizations and groups involved in international agencies and international cooperation.,JnH_3po
SO-06-01-01,JkxoNxQ,"Be able to explore ways of perceiving health, illness, and death in daily life and in outpatient care, home care, hospitalization, and institutionalization.",JnH_3pw
SO-06-01-02,JkxoNxU,"Understand and structurally explain various phenomena related to medical care in relation to current trends, social conditions, and various systems.",JnH_3pw
SO-06-01-03,JkxoNxc,"Understand the influence of culture and customs on individuals and groups (e.g., ways of communication).",JnH_3pw
