index,UID,l4,l3_UID
PS-01-03-17,JkxnuMA,"Understand the life history, risk factors, transmission routes and pathology, and infectious epidemiological significance of microorganisms that cause vector-borne diseases.",JnIAss8
PS-01-03-18,JkxnuMI,Understand the tissues and cells involved in the immune response.,JnIAss8
PS-01-03-19,JkxnuMQ,Understand how complement and innate immune cells are activated by pathogens and cause inflammation.,JnIAss8
PS-01-03-20,JkxnuMU,Understand the basic structure and function of major histocompatibility gene complex class I and class II and the mechanism of T cell activation by antigen presentation.,JnIAss8
PS-01-03-21,JkxnuMY,"Understand the mechanisms of diversity acquisition based on the structure and reaction patterns of immunoglobulins and T cell antigen receptors, and the structure and genetic reconstitution of immunoglobulin and T cell antigen receptor genes.",JnIAss8
PS-01-03-22,JkxnuMc,"Understand the biological defense reactions in which helper T cells (Th1 cells, Th2 cells, and Th17 cells), cytotoxic T cells, and regulatory T cells are respectively responsible.",JnIAss8
PS-01-03-23,JkxnuMg,Understand the mechanism of antibody production by B cell activation and the role of antibodies.,JnIAss8
PS-01-03-24,JkxnuMk,"Understand the major cells constituting the innate immune system and their activation mechanisms (TLRs, etc.).",JnIAss8
PS-01-03-25,JkxnuMo,Understand the types and roles of antigen-presenting cells and the mechanisms of antigen presentation.,JnIAss8
PS-01-03-26,JkxnuMs,"Understand the overview of the characteristics of immune responses to viruses, bacteria, fungi and parasites.",JnIAss8
PS-01-03-27,JkxnuMw,Understand the overview of primary and acquired immunodeficiency syndromes.,JnIAss8
PS-01-03-28,JkxnuM0,Understand the mechanisms of maintenance of immune tolerance and the development of autoimmune diseases due to its breakdown.,JnIAss8
PS-01-03-29,JkxnuM4,Understand the mechanisms of allergy development.,JnIAss8
PS-01-03-30,JkxnuM8,Understand cellular mechanisms involved in cancer immunity.,JnIAss8
PS-01-03-31,JkxnuNA,Understand the dose-response curve of drug/toxin reactivity of a living organism (or group of organisms).,JnIAss8
PS-01-03-32,JkxnuNE,Understands the relationship between receptor binding and pharmacological effects of drugs and agonists and antagonists.,JnIAss8
PS-01-03-33,JkxnuNM,Understand drug adverse effects and drug-drug interactions.,JnIAss8
PS-01-04-01,JkxnuNY,Understand the diversity of individuals based on genomic diversity.,JnIAstE
PS-01-04-02,JkxnuNc,"Understand single gene diseases, diseases caused by chromosomal aberrations, and diseases caused by mitochondrial gene mutations, including the mode of inheritance.",JnIAstE
PS-01-04-03,JkxnuNg,Understand the relationship between genetic and environmental factors in multifactorial diseases.,JnIAstE
PS-01-04-04,JkxnuNk,Understand the relationship between drug efficacy and safety and genomic diversity.,JnIAstE
PS-01-04-05,JkxnuNo,"Understand the diversity, etiology and significance of cell injury/degeneration and cell death, including the difference between necrosis and apoptosis.",JnIAstE
PS-01-04-06,JkxnuNs,Understand the characteristics of cellular and tissue morphological changes in cell injury/degeneration and cell death.,JnIAstE
PS-01-04-07,JkxnuNw,Understand the pathogenesis of disorders of glucose metabolism.,JnIAstE
PS-01-04-08,JkxnuN0,Understand pathogenesis of abnormal protein and amino acid metabolism.,JnIAstE
PS-01-04-09,JkxnuN4,To understand pathophysiology of abnormal lipid metabolism.,JnIAstE
PS-01-04-10,JkxnuN8,To understand the pathophysiology of disorders of nucleic acid and nucleotide metabolism.,JnIAstE
PS-01-04-11,JkxnuOA,To understand pathophysiology of abnormal vitamin and trace element metabolism.,JnIAstE
PS-01-04-12,JkxnuOE,To understand the pathogenesis of metabolic syndrome.,JnIAstE
PS-01-04-13,JkxnuOI,"Understand the difference between hemodynamic disorders (inhibition, hypoxemia, hyperemia, stasis, hemorrhage) and their etiology and pathophysiology, and the types and pathophysiology of infarction (thrombus, embolus).",JnIAstE
PS-01-04-14,JkxnuOQ,"Understands abnormal blood pressure (hypertension, hypotension).",JnIAstE
PS-01-04-15,JkxnuOY,Understand the definition of inflammation.,JnIAstE
PS-01-04-16,JkxnuOc,"Understand classification of inflammation, histomorphological changes and changes over time (local and systemic changes).",JnIAstE
PS-01-04-17,JkxnuOg,Understand the healing process of inflammatory tissues.,JnIAstE
PS-01-04-18,JkxnuOk,"Understands inflammation and its relationship to metabolic syndrome, atherosclerosis, tumors, and aging.",JnIAstE
PS-01-04-19,JkxnuOs,Understands autonomic growth and the difference between benign and malignant tumors.,JnIAstE
PS-01-04-20,JkxnuOw,Understands the causes of cancer and genetic alterations.,JnIAstE
PS-01-04-21,JkxnuO4,"Understands terminology (dysplasia, intraepithelial carcinoma, advanced carcinoma, early-stage carcinoma, atypia, pleomorphism, etc.).",JnIAstE
PS-01-04-22,JkxnuO8,Understands the relationship between pathological diagnosis and treatment of cancer.,JnIAstE
PS-01-04-23,JkxnuPA,Understand the overview of metastasis of cancer.,JnIAstE
PS-01-04-24,JkxnuPE,Understand the mechanism of elimination of cancer by the immune system.,JnIAstE
PS-02-01-01,JmpZNJo,Understand organ-specific and systemic diseases (Table [Diseases]).,JnIAstI
PS-02-02-01,JkxnuPM,"Understand the basic structure and function of blood, blood-forming organs, and lymphatic system (Table [Blood, Blood-forming organs, Lymphatic system]).",JnIAstQ
PS-02-02-02,JkxnuPQ,"Understand the symptoms found in the blood, hematopoietic, and lymphatic systems (Table [blood, hematopoietic, and lymphatic systems]).",JnIAstQ
PS-02-02-03,JkxnuPU,"Understand the basic information about the methods of examination of the blood, blood-forming organs, and lymphatic system (Table [blood, blood-forming organs, lymphatic system]).",JnIAstQ
PS-02-02-04,JkxnuPY,"Understand the basics of treatments specific to diseases of the blood, blood-forming organs, and lymphatic system (Table [blood, blood-forming organs, lymphatic system]).",JnIAstQ
PS-02-02-05,JkxnuPc,"Understand the etiology, epidemiology, syndromes, examination, diagnosis, and treatment of diseases and conditions of the blood, hematopoietic, and lymphatic systems (Table [Blood, Hematopoietic, and Lymphatic Systems]).",JnIAstQ
PS-02-03-01,JkxnuPk,Understand the basic structure and function of the nervous system (Table [Nervous System]).,JnIAstY
PS-02-03-02,JkxnuPo,Understand the symptoms that can be seen in the nervous system (Table [Nervous System]).,JnIAstY
PS-02-03-03,JkxnuPs,Understand basic information about examination methods used in the nervous system (Table [Nervous System]).,JnIAstY
PS-02-03-04,JkxnuPw,Understand the basics of treatments specific to diseases of the nervous system (Table [Nervous System]).,JnIAstY
PS-02-03-05,JkxnuP0,"Understand etiology, epidemiology, syndromes, examination, diagnosis, and treatment of diseases and conditions of the nervous system (Table [Nervous System]).",JnIAstY
PS-02-04-01,JkxnuP4,Understand the basic structure and function of the dermatological system (Table [Dermatological System]).,JnIAstc
PS-02-04-02,JkxnuP8,Understand the symptoms that can be seen in the dermatological system (Table [Dermatology]).,JnIAstc
PS-02-04-03,JkxnuQA,Understand basic information on examination methods for the dermatological system (Table [Dermatology]).,JnIAstc
PS-02-04-04,JkxnuQE,Understand the basics of treatment methods specific to diseases of the dermatological system (Table [Dermatology]).,JnIAstc
PS-02-04-05,JkxnuQI,"Understand etiology, epidemiology, syndromes, examination, diagnosis, and treatment of diseases and conditions of the dermatological system (Table [Dermatological System]).",JnIAstc
PS-02-05-01,JkxnuQM,Understand the basics of the structure and function of the musculoskeletal system (Table [Musculoskeletal System]).,JnIAstk
PS-02-05-02,JkxnuQQ,Understand the symptoms that can be seen in the musculoskeletal system (Table [Musculoskeletal System]).,JnIAstk
PS-02-05-03,JkxnuQU,Understand the basics of examination procedures performed on the musculoskeletal system (Table [Musculoskeletal System]).,JnIAstk
PS-02-05-04,JkxnuQY,Understand the basics of treatments specific to diseases of the musculoskeletal system (Table [Musculoskeletal System]).,JnIAstk
PS-02-05-05,JkxnuQc,"Understand the etiology, epidemiology, syndromes, examination, diagnosis, and treatment of diseases and conditions of the musculoskeletal system (Table [musculoskeletal system]).",JnIAstk
PS-02-06-01,JkxnuQg,Understand the basic structure and function of the circulatory system (Table [Cardiovascular System]).,JnIAsto
PS-02-06-02,JkxnuQk,Understand the symptoms that can be seen in the circulatory system (Table [Cardiovascular System]).,JnIAsto
PS-02-06-03,JkxnuQo,Understand the basic information on examination procedures for the circulatory system (Table [Cardiovascular System]).,JnIAsto
PS-02-06-04,JkxnuQs,Understand the basics of treatment methods specific to diseases of the circulatory system (Table [Cardiovascular System]).,JnIAsto
PS-02-06-05,JkxnuQw,"Understand etiology, epidemiology, symptomatology, examination, diagnosis, and treatment of diseases and conditions of the circulatory system (Table [Cardiovascular System]).",JnIAsto
PS-02-07-01,JkxnuQ0,Understand the basic structure and function of the respiratory system (Table [Respiratory System]).,JnIAstw
PS-02-07-02,JkxnuQ4,Understand the symptoms that can be seen in the respiratory system (Table [Respiratory System]).,JnIAstw
PS-02-07-03,JkxnuQ8,Understand the basic information on the examination methods used in the respiratory system (Table [Respiratory System]).,JnIAstw
PS-02-07-04,JkxnuRA,Understand the basics of treatment methods specific to respiratory diseases (Table [Respiratory System]).,JnIAstw
PS-02-07-05,JkxnuRE,"Understand the etiology, epidemiology, syndromes, examination, diagnosis, and treatment of diseases and conditions of the respiratory system (Table [Respiratory System]).",JnIAstw
PS-02-08-01,JkxnuRI,Understand the basic structure and function of the digestive system (Table [Digestive System]).,JnIAst0
PS-02-08-02,JkxnuRM,Understand the symptoms that can be seen in the digestive system (Table [Gastrointestinal System]).,JnIAst0
PS-02-08-03,JkxnuRQ,Understand the basic information about the examination methods used in the digestive system (Table [Gastrointestinal System]).,JnIAst0
PS-02-08-04,JkxnuRU,Understand basic information about treatment methods specific to diseases of the digestive system (Table [Gastrointestinal System]).,JnIAst0
PS-02-08-05,JkxnuRY,"Understand the etiology, epidemiology, syndromes, examination, diagnosis, and treatment of diseases and conditions of the digestive system (Table [Digestive System]).",JnIAst0
PS-02-09-01,JkxnuRc,Understand the basic structure and function of the renal and urinary tract system (Table [Renal and Urinary Tract System (including fluid and electrolyte balance)]).,JnIAst8
PS-02-09-02,JkxnuRg,Understand the syndromes found in the renal and urinary system (Table [Renal and Urinary System (Including Fluid and Electrolyte Balance)]).,JnIAst8
PS-02-09-03,JkxnuRk,Understand the basics of the renal and urinary tract examination procedures (Table [Renal and Urinary Tract System (including fluid and electrolyte balance)]).,JnIAst8
PS-02-09-04,JkxnuRo,Understand the basics of treatments specific to renal and urinary tract diseases (Table [Renal and Urinary System (Including Fluid and Electrolyte Balance)]).,JnIAst8
PS-02-09-05,JkxnuRs,"Understand the etiology, epidemiology, syndromes, examination, diagnosis, and treatment of diseases and conditions of the renal and urinary tract system (Table [Renal and Urinary System (including fluid and electrolyte balance)]).",JnIAst8
PS-02-10-01,Jn46SWA,,JnIAsuA
PS-02-10-02,JkxnuR0,Understand the syndromes found in the reproductive system (Table [Reproductive System]).,JnIAsuA
PS-02-10-03,JkxnuR4,Understand the basics of the examination procedures performed on the reproductive system (Table [Reproductive System]).,JnIAsuA
PS-02-10-04,JkxnuR8,Understand the basics of treatment methods specific to diseases of the reproductive system (Table [Reproductive System]).,JnIAsuA
PS-02-10-05,JkxnuSA,"Understand the etiology, epidemiology, symptoms, examination, diagnosis, and treatment of diseases and conditions related to the reproductive system (Table [Reproductive System]).",JnIAsuA
PS-02-11-01,JkxnuSE,Understand the basic structure and function of pregnancy and delivery (Table [Pregnancy and Delivery]).,JnIAsuI
PS-02-11-02,JkxnuSI,Understand the symptoms seen in pregnancy and labor (Table [Pregnancy and Labor]).,JnIAsuI
PS-02-11-03,JkxnuSM,Understand the basics of the examination procedures performed during pregnancy and labor (Table [Pregnancy and Labor]).,JnIAsuI
PS-02-11-04,JkxnuSQ,Understand the basics of treatment specific to pregnancy and delivery (Table [Pregnancy and Delivery]).,JnIAsuI
PS-02-11-05,JkxnuSU,"Understand the etiology, epidemiology, syndromes, examination, diagnosis, and treatment of diseases and conditions related to pregnancy and delivery (Table [Pregnancy and Delivery]).",JnIAsuI
PS-02-12-01,Jli53Ic,Understand the syndromes seen in children (Table [Pediatrics]).,JnIAsuM
PS-02-12-02,Jli53IY,Understand the basics of pediatric laboratory procedures (Table [Pediatric]).,JnIAsuM
PS-02-12-03,Jli53IQ,Understand the basics of pediatric-specific treatments (Table [Pediatric]).,JnIAsuM
PS-02-12-04,Jli53IM,"Understand etiology, epidemiology, syndromes, examination, diagnosis, and treatment of pediatric diseases and conditions (Table [Pediatric]).",JnIAsuM
PS-02-13-01,JkxnuSY,Understand the basic structure and function of the breast (Table [Breast]).,JnIAsuU
PS-02-13-02,JkxnuSc,Understands the symptoms seen in the breast (Table [Breast]).,JnIAsuU
PS-02-13-03,JkxnuSg,Understand the basics of breast examination procedures (Table [Breast]).,JnIAsuU
PS-02-13-04,JkxnuSk,Understand basic information about treatment methods specific to breast diseases (Table [Breast]).,JnIAsuU
PS-02-13-05,JkxnuSs,"Understand the etiology, epidemiology, syndromes, examination, diagnosis, and treatment of diseases and conditions related to the breast (Table [Breast]).",JnIAsuU
PS-02-14-01,JkxnuSw,"Understand the basic structure and function of the endocrine, nutritional, and metabolic systems (Table [Endocrine, Nutritional, and Metabolic Systems]).",JnIAsuc
PS-02-14-02,JkxnuS0,"Understand the syndromes found in the endocrine, nutritional, and metabolic systems (Table [Endocrine, Nutritional, and Metabolic Systems]).",JnIAsuc
PS-02-14-03,JkxnuS4,"Understand the basics of the endocrine, nutritional, and metabolic examination procedures (Table [Endocrine, Nutritional, and Metabolic Systems]).",JnIAsuc
PS-02-14-04,JkxnuS8,"Understand the basics of treatments specific to endocrine, nutritional, and metabolic diseases (Table [Endocrine, Nutritional, and Metabolic Systems]).",JnIAsuc
PS-02-14-05,JkxnuTA,"Understand the etiology, epidemiology, syndromes, examination, diagnosis, and treatment of endocrine, nutritional, and metabolic diseases and conditions (Table [Endocrine, Nutritional, and Metabolic Systems]).",JnIAsuc
PS-02-14-06,JkxnuOE,Understand the pathogenesis of metabolic syndrome.,JnIAsuc
PS-02-15-01,JkxnuTE,Understand the basic structure and function of the ocular and visual system (Table [Ocular and Visual System]).,JnIAsug
PS-02-15-02,JkxnuTI,Understand the symptoms that occur in the ocular and visual system (Table [Ocular and Visual System]).,JnIAsug
PS-02-15-03,JkxnuTM,Understand the basic information on examination procedures for the eye and visual system (Table [Ocular and Visual System]).,JnIAsug
PS-02-15-04,JkxnuTQ,Understand the basics of treatment methods specific to diseases of the eye and visual system (Table [Ocular and Visual System]).,JnIAsug
PS-02-15-05,JkxnuTU,"Understand etiology, epidemiology, syndromes, examination, diagnosis, and treatment of diseases and conditions of the eye and visual system (Table [Ocular and Visual System]).",JnIAsug
PS-02-16-01,JkxnuTY,"Understand the basic structure and function of the ear, nose, throat, and oral cavity (Table [Otorhinolaryngology]).",JnIAsuo
PS-02-16-02,JkxnuTc,"Understand the symptoms found in the ear, nose, throat, and oral cavity (Table [Otorhinolaryngology]).",JnIAsuo
PS-02-16-03,JkxnuTg,Understand the basic items regarding examination methods for the otorhinolaryngological and oral cavity system (Table [Otorhinolaryngological and Oral cavity System]).,JnIAsuo
PS-02-16-04,JkxnuTk,"Understand the basics of treatment methods specific to diseases of the ear, nose, throat, and oral cavity (Table [Otorhinolaryngology]).",JnIAsuo
PS-02-16-05,JkxnuTo,"Understand the etiology, epidemiology, syndromes, examination, diagnosis, and treatment of diseases and conditions of the ear, nose, throat, and oral cavity (Table [Otorhinolaryngology]).",JnIAsuo
PS-02-17-01,JkxnuTs,Understand the basic structure and function of the mental system (Table [Mental System]).,JnIAsus
PS-02-17-02,JkxnuTw,Understand the symptoms found in the mental system (Table [mental system]).,JnIAsus
PS-02-17-03,JkxnuT0,Understand basic information about examination methods used in the mental health care system (Table [mental health care system]).,JnIAsus
PS-02-17-04,JkxnuT4,Understand basic information about treatment methods specific to mental disorders (Table [Mental Disorders]).,JnIAsus
PS-02-17-05,JkxnuT8,"Understand etiology, epidemiology, syndromes, examination, diagnosis, and treatment of diseases and conditions of the mental system (Table [mental system]).",JnIAsus
PS-03-01-01,JkxnuUA,Understand an overview of Hardy-Weinberg's law as a basis for population genetics.,JnIAsu0
PS-03-01-02,JkxnuUE,Be able to create and evaluate a family tree.,JnIAsu0
PS-03-01-03,JkxnuUI,"Understands the difference between germline and somatic mutations, and the purpose and significance of genetic testing.",JnIAsu0
PS-03-01-04,JkxnuUM,"Understand the characteristics of genetic information (constancy, predictability, and shareability).",JnIAsu0
PS-03-01-05,JkxnuUQ,Understand the significance and methods of genetic counseling.,JnIAsu0
PS-03-01-06,JkxnuUU,"Understand ethical, legal, and social considerations in genetic medicine.",JnIAsu0
PS-03-01-07,JkxnuUY,To be able to access information related to genetic medicine.,JnIAsu0
PS-03-01-08,JkxnuUc,Understands an overview of appropriate measures including treatment and prevention based on genetic information.,JnIAsu0
PS-03-02-01,JnGUA2Q,"Understands the concepts of collagen disease, vasculitis, rheumatic disease, allergic disease, and autoimmune disease with distinction and can list the diseases included in each (Table [Immunology and Allergy]).",JnIAsu4
PS-03-02-02,JnGUA2Y,"Describe the symptoms and signs seen in collagen disease, vasculitis, rheumatic disease, allergic disease, and autoimmune disease (Table [Immunology and Allergy]).",JnIAsu4
PS-03-02-03,JnGUA2g,Understand the principles of immunoserology testing and the clinical significance of test results (Table [Immunology/Allergy]).,JnIAsu4
PS-03-02-04,JnGUA2o,"Understand the therapeutic agents used in collagen disease, vasculitis, rheumatic diseases, allergic diseases, and autoimmune diseases (Table [Immunology/Allergy]).",JnIAsu4
PS-03-02-05,JnGUA2s,"Explain the etiology, epidemiology, syndromes, main tests/diagnoses, treatments, and complications of diseases and conditions of collagen diseases, vasculitis, rheumatic diseases, allergic diseases, and autoimmune diseases (Table [Immunology and Allergy]).",JnIAsu4
PS-03-03-01,JkxnuUg,Understand the causative microorganisms of typical community-acquired infections (Table [Infectious Diseases]).,JnIAsvA
PS-03-03-02,JkxnuUk,Understand the causative microorganisms of typical healthcare-associated infections (Table [Infectious Diseases]).,JnIAsvA
PS-03-03-03,JkxnuUo,Understand the typical microorganisms that predispose immunocompromised patients (Table [Infectious Diseases]).,JnIAsvA
PS-03-03-04,JkxnuUs,"Understand the current status of drug resistance, typical drug-resistant organisms (methicillin-resistant Staphylococcus aureus), and preventive measures such as proper use of antimicrobial agents.",JnIAsvA
PS-03-03-05,JkxnuUw,"Understand the relationship between the patient (host), the organ/site of infection, and the causative microorganism.",JnIAsvA
PS-03-03-06,JkxnuU0,"Understand risk factors, routes of infection, entry gates, and pathophysiology of typical community-acquired infections.",JnIAsvA
PS-03-03-07,JkxnuU4,"Understand the risk factors, routes/gates of entry, and pathophysiology of typical healthcare-associated infections.",JnIAsvA
PS-03-03-08,JkxnuU8,"Understand the difference between sepsis and bloodstream infection, and understand their pathophysiology.",JnIAsvA
PS-03-03-09,JkxnuVA,"Understand the routes of transmission of emerging infectious diseases and other infectious agents, and understand the necessary infection control measures.",JnIAsvA
PS-03-03-10,JkxnuVE,Understand the infectious organs and causative microorganisms from the medical interview and physical examination.,JnIAsvA
PS-03-03-11,JkxnuVI,Understand how to diagnose the causative microorganisms based on the medical interview and physical examination.,JnIAsvA
PS-03-03-12,JkxnuVM,"Understands basic laboratory tests (2 sets of blood cultures, urinalysis/urine culture, and chest radiograph) for patients with fever.",JnIAsvA
PS-03-03-13,JkxnuVQ,"Understands the principles of antimicrobial drug administration (culture specimens should be submitted prior to antimicrobial administration, standard drugs should be selected based on microorganisms and organs, and the duration of administration should be set).",JnIAsvA
PS-03-03-14,JkxnuVU,Understands initial antimicrobial therapy (empiric therapy).,JnIAsvA
PS-03-03-15,JkxnuVY,Understands optimal antimicrobial therapy (targeted therapy).,JnIAsvA
PS-03-03-16,JkxnuVc,Understand vaccine-preventable diseases.,JnIAsvA
PS-03-03-17,JkxnuVg,"Understands occupational infection control (vaccination, needle puncture wounds and body fluid exposure, tuberculosis exposure, etc.).",JnIAsvA
PS-03-03-18,JkxnuVo,"Understand standard precautions (standard precautions), pathogenic microorganisms requiring route-specific precautions (droplet, contact, airborne, etc.), personal protective equipment to prevent exposure of pathogenic microorganisms from patients to healthcare workers, and infection control measures following exposure of healthcare workers to bodily fluids, including vaccination. The student understands the definition of a tumor and its characteristics.",JnIAsvA
PS-03-04-01,JkxnuXM,"Understand the definition of tumors and their characteristics, along with genomic abnormalities and molecular mechanisms.",JnIAsvE
PS-03-04-02,JkxnuXQ,Understand the frequency of each tumor in Japan and around the world.,JnIAsvE
PS-03-04-03,JkxnuXU,"Understand risk factors such as genetic predisposition, underlying diseases, infectious diseases, and environmental lifestyle for the development of neoplastic diseases, as well as tumor prevention and screening.",JnIAsvE
PS-03-04-04,JkxnuXY,"Understand tumor-specific tests and their findings, such as tumor markers, biomarkers, and cancer gene panel tests.",JnIAsvE
PS-03-04-05,JkxnuXc,"Understand and diagnose abnormal findings of endoscopy and imaging tests (X-ray, CT, MRI, PET/nuclear medicine, ultrasound, etc.) for tumors.",JnIAsvE
PS-03-04-06,JkxnuXg,"Understand the outline of biopsy, cytology, and pathology of tumors and their findings.",JnIAsvE
PS-03-04-07,JkxnuXk,Understand TNM classification and stages of tumors.,JnIAsvE
PS-03-04-08,JkxnuXo,Understands the syndromes of cancer patients.,JnIAsvE
PS-03-04-09,JkxnuXs,"Understand the presentation, diagnosis, and treatment of major hematopoietic tumors (Table [Tumors]).",JnIAsvE
PS-03-04-10,JkxnuXw,"Understand the presentation, diagnosis, and treatment of major brain tumors (Table [Tumors]).",JnIAsvE
PS-03-04-11,JkxnuX0,"Understand the presentation, diagnosis, and treatment of major skin tumors (Table [Tumors]).",JnIAsvE
PS-03-04-12,JkxnuX4,"Understand the presentation, diagnosis, and treatment of major bone and soft tissue tumors (Table [Tumors]).",JnIAsvE
PS-03-04-13,JkxnuYA,"Understand the presentation, diagnosis, and treatment of major thoracic (respiratory) tumors (Table [Tumors]).",JnIAsvE
PS-03-04-14,JkxnuYE,"Understand the presentation, diagnosis, and treatment of major gastrointestinal tumors (Table [Tumors]).",JnIAsvE
PS-03-04-15,JkxnuYI,"Understand the presentation, diagnosis, and treatment of major urologic tumors (Table [Tumors]).",JnIAsvE
PS-03-04-16,JkxnuYM,"Understand the presentation, diagnosis, and treatment of major genitourinary system tumors (Table [Tumors]).",JnIAsvE
PS-03-04-17,JkxnuYQ,"Understands the presentation, diagnosis, and treatment of major breast tumors (Table [Tumors]).",JnIAsvE
PS-03-04-18,JkxnuYU,"Understands the presentation, diagnosis, and treatment of major endocrine system tumors (Table [Tumors]).",JnIAsvE
PS-03-04-19,JkxnuYc,"Understand the presentation, diagnosis, and treatment of major head and neck cancers (Table [Oncology]).",JnIAsvE
PS-03-04-20,JkxnuYg,"Understand the major pediatric tumor types, syndromes, diagnosis, and treatment (Table [Tumors]).",JnIAsvE
PS-03-04-21,JkxnuYk,"Understands an overview of the types, syndromes, diagnosis, and treatment of cancers of unknown primary, metastatic, overlapping, AYA, and rare cancers (Table [Oncology]).",JnIAsvE
PS-03-04-22,JkxnuYw,"Oncology emergencies (spinal cord compression, tumor collapse, superior vena cava syndrome, metabolic disorders).",JnIAsvE
PS-03-04-23,JkxnuY4,Understand the indications for surgical treatment of major tumors (Table [Tumors]).,JnIAsvE
